{
  "$schema": "http://json-schema.org/draft-07/schema#",
  "title": "Local Candidate Experiment Manifest",
  "type": "object",
  "additionalProperties": true,
  "required": [
    "schema_version",
    "candidate_id",
    "problem",
    "target_id",
    "hypothesis_id",
    "baseline_snapshot_path",
    "baseline_guard_study",
    "candidate_profile_or_overrides",
    "allowed_budget_policy",
    "expected_primary_metric",
    "expected_non_regression_metrics",
    "stress_slices_to_check",
    "seed_policy",
    "decision_policy",
    "notes"
  ],
  "properties": {
    "schema_version": {
      "type": "integer",
      "const": 1
    },
    "candidate_id": {
      "type": "string",
      "minLength": 1
    },
    "problem": {
      "type": "string",
      "enum": ["tsp", "zdt1", "knapsack", "onemax"]
    },
    "target_id": {
      "type": "string",
      "minLength": 1
    },
    "hypothesis_id": {
      "type": "string",
      "minLength": 1
    },
    "baseline_snapshot_path": {
      "type": "string",
      "minLength": 1
    },
    "baseline_guard_study": {
      "type": "string",
      "minLength": 1
    },
    "candidate_study": {
      "type": "string",
      "minLength": 1
    },
    "existing_output_dir": {
      "type": "string",
      "minLength": 1
    },
    "candidate_profile_or_overrides": {
      "type": "object"
    },
    "allowed_budget_policy": {
      "type": "string",
      "minLength": 1
    },
    "expected_primary_metric": {
      "type": "string",
      "minLength": 1
    },
    "expected_non_regression_metrics": {
      "type": "array",
      "minItems": 1,
      "items": {
        "type": "string"
      }
    },
    "stress_slices_to_check": {
      "type": "array",
      "minItems": 1,
      "items": {
        "type": "string"
      }
    },
    "seed_policy": {
      "type": "object"
    },
    "decision_policy": {
      "type": "object"
    },
    "notes": {
      "type": "string",
      "minLength": 1
    },
    "expected_decision_label": {
      "type": "string",
      "enum": [
        "reject_regression",
        "reject_no_material_gain",
        "note_only_stress_slice",
        "monitor_only",
        "candidate_promising_needs_confirm",
        "candidate_passes_local_guard",
        "candidate_requires_new_mechanism_hypothesis",
        "baseline_drift_detected",
        "intentional_baseline_change_required"
      ]
    },
    "baseline_variant": {
      "type": "string"
    },
    "candidate_variant": {
      "type": "string"
    },
    "quality_variant": {
      "type": "string"
    },
    "comparison_variants": {
      "type": "array",
      "items": {
        "type": "string"
      }
    }
  }
}
